{
  "id": "2030-01-01_Day1",
  "workflowId": "video-diary-default",
  "contentType": "video-diary",
  "date": "2030-01-01",
  "title": "示例视频日记",
  "channel": "canary",
  "systemVersion": "3.0.0",
  "status": "waiting_user",
  "currentStage": "review_ready",
  "revision": 12,
  "publishReady": false,
  "createdAt": "2030-01-01T09:00:00+08:00",
  "updatedAt": "2030-01-01T10:00:00+08:00",
  "updatedBy": "codex-desktop",
  "steps": [
    {
      "id": "step_subtitle",
      "status": "succeeded",
      "ownerAgent": "video-agent"
    }
  ],
  "artifacts": [
    {
      "id": "artifact_corrected_srt",
      "runId": "2030-01-01_Day1",
      "stepId": "subtitles",
      "type": "subtitle",
      "label": "校正字幕",
      "relativePath": "04_videos/2030-01-01/subtitles/corrected.srt",
      "available": true
    }
  ]
}
